### ISSUE TITLE
push api loses active connection after a while 

### ISSUE THREAD

**Issue by groob** [micromdm/micromdm#215]
If I use the `/push` endpoint to trigger a push notification 

```
{
  "error": "Post https://api.push.apple.com/3/device/[redacted]: read tcp [redacted]: read: connection reset by peer"
}
```

sending it a second time causes messages to succeed after. 

This might be an internal thing we're not being careless about, or something to look at in bufford. 

needs investigation

**Comment by jessepeterson** [comment]
Hmm, if this expected behavior from bufford then we should gracefully handle this by trying again once to re-establish the connection, no?

**Comment by azherdev1978** [comment]
Was able to reproduce the issue twice:

1. Start micromdm process
2. Enroll a device
3. Send DeviceLock to iOS device (10.3)
4. Everything works fine, multiple requests, 1 second apart, 10 seconds apart, etc.
5. Went to get a snack, came back 10 minutes later <--- VERY important
6. Unlocked the phone and started looking at config values, surfing the web (actively using it and had network connectivity)
7. Sent a DeviceLock.... queued, nothing else happens (no errors in logs)
8. Repeated this 10 seconds apart 3 - 4 times
9. Stopped ( CTRL-C ) the micromdm service
10. Started the service again
11. Sent a DeviceLock again, now all 3 previously queued checked in and device was locked

Restarting service and sending a command immediately executes the backlog

Ubuntu 16.04LTS
Compiled latest build as of Jun 11 2017 (25a07b8)
Command line
Production Apple MDM Push Certificates
sudo ./micromdm serve -server-url=https://stg-mdm-ios.sample.com -tls-cert=./ssl.crt -tls-key=./ssl.key -api-key=123 -apns-key=./push.pem -apns-cert=./push.crt

**Comment by azherdev1978** [comment]
FYI: Found where debugger stops and never continues "buford/push/service.go," func Push, line 79.

This line never continues (waited 60s+):
79: 	resp, err := s.Client.Do(req)

Quick fix for me was to add idle timeout in the "NewClient" function:
transport.IdleConnTimeout = time.Second * 10

So far long idle times do not prevent push notifications

**Comment by knightsc** [comment]
I wonder if the buford library is missing other default values since they're creating their own `http.Transport` instance

https://golang.org/src/net/http/transport.go

```
// DefaultTransport is the default implementation of Transport and is
// used by DefaultClient. It establishes network connections as needed
// and caches them for reuse by subsequent calls. It uses HTTP proxies
// as directed by the $HTTP_PROXY and $NO_PROXY (or $http_proxy and
// $no_proxy) environment variables.
var DefaultTransport RoundTripper = &Transport{
	Proxy: ProxyFromEnvironment,
	DialContext: (&net.Dialer{
		Timeout:   30 * time.Second,
		KeepAlive: 30 * time.Second,
		DualStack: true,
	}).DialContext,
	MaxIdleConns:          100,
	IdleConnTimeout:       90 * time.Second,
	TLSHandshakeTimeout:   10 * time.Second,
	ExpectContinueTimeout: 1 * time.Second,
}
```

@azherdev1978 after setting the `IdleConnTimeout` do you get any sort of `http: idle connection timeout` error in the logs or is the buford library just handling that on their own?

Is there a way to set the `IdleConnTimeout` ourselves in the `platform/apns/service.go` `NewPushService` function after we get the `http.Client` back from the buford library?

**Comment by groob** [comment]
Nice find! 

We can set the timeouts ourselves. 

Solution one is to modify the `http.Client` returned by bufford's helper and set the timeout values. 
https://github.com/micromdm/micromdm/blob/24efe18538a4712cab6013431e2f6cda39745022/cmd/micromdm/serve.go#L578

Solution two would be to just replace the helper from bufford and create our own client. The helper doesn't do anything special. 
https://github.com/RobotsAndPencils/buford/blob/f7b54b6fc6e976e4d9f7fb851042a0c2ab4795c5/push/service.go#L44-L56

**Comment by knightsc** [comment]
Solution #2 seems to be exactly what buford recommends

https://github.com/RobotsAndPencils/buford/issues/87

**Comment by jessepeterson** [comment]
It seems my suspicions were correct in that a long-standing open TCP connection was probably getting killed by folks routers/networks/etc.  However I have a couple questions here:

* A blank `http.Client` _seems_ like something to bump to the upstream project as at least a concern. Seems like they'd want most of the default values (as would anybody) then modify to their needs? Have we done that?
* A 1.5 minute Idle connection timeout now exists, but this still doesn't address the underlying issue of a broken connection needing a try/retry technique. (I.e. we'll lose a given push notification if the connection dies for any _other_ reason). While unlikely for 1.5 minutes it seems either us, or the buford project should solve that.
* Before closing the issue I'd like to get verification this issue is indeed solved for the folks who have seen it? It _seems_ like the issue @azherdev1978 has reported is different then the OPs issue (as the latter has a specific error, and the former is just seeing timeouts).

I think the MicroMDM project exasperates this problem to some degree for beginners because most people probably test with a just a couple devices sending just a couple push notifications and it's otherwise idle. An active MDM (or other software product using push notifications) is probably sending APNs notifications all the time (i.e. the idle timeout isn't really ever reached because its never idle).

**Comment by groob** [comment]
> A blank http.Client seems like something to bump to the upstream project as at least a concern. Seems like they'd want most of the default values (as would anybody) then modify to their needs? Have we done that?

I don't think that's true. MicroMDM is the caller, and should customize the client as needed. The fact that we were using a helper is kind of silly to begin with. 

I mostly agree with the rest.

**Comment by jessepeterson** [comment]
>  I don't think that's true. MicroMDM is the caller, and should customize the client as needed. The fact that we were using a helper is kind of silly to begin with.

I mean if we want to use a customized client that's fine. I raised the issue mainly to ask if it was bufords _intention_ to have a non-standard configuration in their helper. If it wasn't they should know about it.

**Comment by arcidodo** [comment]
same here:

when i test with the Push command:
`https://mdm.corp.nl/push/DD3565AF-633B-SNIP-123456`

the first 5 min its ok here the tcpdump of the first 5 minutes:


`MDM:~$ sudo tcpdump -i eth0 -n host 17.188.136.25
tcpdump: verbose output suppressed, use -v or -vv for full protocol decode
listening on eth0, link-type EN10MB (Ethernet), capture size 262144 bytes
12:41:34.388985 IP 10.0.0.4.48754 > 17.188.136.25.443: Flags [P.], seq 1245112164:1245112202, ack 1182711053, win 288, options [nop,nop,TS val 266057937 ecr 13896196], length 38
12:41:34.389214 IP 10.0.0.4.48754 > 17.188.136.25.443: Flags [P.], seq 38:144, ack 1, win 288, options [nop,nop,TS val 266057937 ecr 13896196], length 106
12:41:34.533618 IP 17.188.136.25.443 > 10.0.0.4.48754: Flags [.], ack 144, win 308, options [nop,nop,TS val 13924142 ecr 266057937], length 0
12:41:34.533776 IP 17.188.136.25.443 > 10.0.0.4.48754: Flags [P.], seq 1:63, ack 144, win 308, options [nop,nop,TS val 13924143 ecr 266057937], length 62
12:41:34.533801 IP 10.0.0.4.48754 > 17.188.136.25.443: Flags [.], ack 63, win 288, options [nop,nop,TS val 266058082 ecr 13924143], length 0
12:41:35.579871 IP 10.0.0.4.48754 > 17.188.136.25.443: Flags [P.], seq 144:182, ack 63, win 288, options [nop,nop,TS val 266059128 ecr 13924143], length 38
12:41:35.580073 IP 10.0.0.4.48754 > 17.188.136.25.443: Flags [P.], seq 182:288, ack 63, win 288, options [nop,nop,TS val 266059128 ecr 13924143], length 106
12:41:35.724357 IP 17.188.136.25.443 > 10.0.0.4.48754: Flags [.], ack 288, win 308, options [nop,nop,TS val 13925333 ecr 266059128], length 0
12:41:35.724723 IP 17.188.136.25.443 > 10.0.0.4.48754: Flags [P.], seq 63:124, ack 288, win 308, options [nop,nop,TS val 13925334 ecr 266059128], length 61
12:41:35.724746 IP 10.0.0.4.48754 > 17.188.136.25.443: Flags [.], ack 124, win 288, options [nop,nop,TS val 266059273 ecr 13925334], length 0
12:41:37.873826 IP 10.0.0.4.48754 > 17.188.136.25.443: Flags [P.], seq 288:326, ack 124, win 288, options [nop,nop,TS val 266061422 ecr 13925334], length 38
12:41:37.873986 IP 10.0.0.4.48754 > 17.188.136.25.443: Flags [P.], seq 326:432, ack 124, win 288, options [nop,nop,TS val 266061422 ecr 13925334], length 106
12:41:38.018268 IP 17.188.136.25.443 > 10.0.0.4.48754: Flags [.], ack 432, win 308, options [nop,nop,TS val 13927627 ecr 266061422], length 0
12:41:38.018592 IP 17.188.136.25.443 > 10.0.0.4.48754: Flags [P.], seq 124:186, ack 432, win 308, options [nop,nop,TS val 13927628 ecr 266061422], length 62
12:41:38.018625 IP 10.0.0.4.48754 > 17.188.136.25.443: Flags [.], ack 186, win 288, options [nop,nop,TS val 266061567 ecr 13927628], length 0
12:41:38.615790 IP 10.0.0.4.48754 > 17.188.136.25.443: Flags [P.], seq 432:470, ack 186, win 288, options [nop,nop,TS val 266062164 ecr 13927628], length 38
12:41:38.615955 IP 10.0.0.4.48754 > 17.188.136.25.443: Flags [P.], seq 470:576, ack 186, win 288, options [nop,nop,TS val 266062164 ecr 13927628], length 106
12:41:38.760556 IP 17.188.136.25.443 > 10.0.0.4.48754: Flags [.], ack 576, win 308, options [nop,nop,TS val 13928369 ecr 266062164], length 0
12:41:38.760590 IP 17.188.136.25.443 > 10.0.0.4.48754: Flags [P.], seq 186:249, ack 576, win 308, options [nop,nop,TS val 13928370 ecr 266062164], length 63
12:41:38.760603 IP 10.0.0.4.48754 > 17.188.136.25.443: Flags [.], ack 249, win 288, options [nop,nop,TS val 266062309 ecr 13928370], length 0
12:41:39.189358 IP 10.0.0.4.48754 > 17.188.136.25.443: Flags [P.], seq 576:614, ack 249, win 288, options [nop,nop,TS val 266062737 ecr 13928370], length 38
12:41:39.189861 IP 10.0.0.4.48754 > 17.188.136.25.443: Flags [P.], seq 614:720, ack 249, win 288, options [nop,nop,TS val 266062738 ecr 13928370], length 106
12:41:39.334044 IP 17.188.136.25.443 > 10.0.0.4.48754: Flags [.], ack 720, win 308, options [nop,nop,TS val 13928943 ecr 266062737], length 0
12:41:39.334599 IP 17.188.136.25.443 > 10.0.0.4.48754: Flags [P.], seq 249:312, ack 720, win 308, options [nop,nop,TS val 13928944 ecr 266062737], length 63
12:41:39.334626 IP 10.0.0.4.48754 > 17.188.136.25.443: Flags [.], ack 312, win 288, options [nop,nop,TS val 266062883 ecr 13928944], length 0
12:41:39.742849 IP 10.0.0.4.48754 > 17.188.136.25.443: Flags [P.], seq 720:758, ack 312, win 288, options [nop,nop,TS val 266063291 ecr 13928944], length 38
12:41:39.743057 IP 10.0.0.4.48754 > 17.188.136.25.443: Flags [P.], seq 758:864, ack 312, win 288, options [nop,nop,TS val 266063291 ecr 13928944], length 106
12:41:39.887687 IP 17.188.136.25.443 > 10.0.0.4.48754: Flags [.], ack 864, win 308, options [nop,nop,TS val 13929497 ecr 266063291], length 0
12:41:39.888502 IP 17.188.136.25.443 > 10.0.0.4.48754: Flags [P.], seq 312:375, ack 864, win 308, options [nop,nop,TS val 13929497 ecr 266063291], length 63
12:41:39.888528 IP 10.0.0.4.48754 > 17.188.136.25.443: Flags [.], ack 375, win 288, options [nop,nop,TS val 266063437 ecr 13929497], length 0
12:41:40.315684 IP 10.0.0.4.48754 > 17.188.136.25.443: Flags [P.], seq 864:902, ack 375, win 288, options [nop,nop,TS val 266063864 ecr 13929497], length 38
12:41:40.315948 IP 10.0.0.4.48754 > 17.188.136.25.443: Flags [P.], seq 902:1008, ack 375, win 288, options [nop,nop,TS val 266063864 ecr 13929497], length 106
12:41:40.460121 IP 17.188.136.25.443 > 10.0.0.4.48754: Flags [.], ack 1008, win 308, options [nop,nop,TS val 13930069 ecr 266063864], length 0
12:41:40.460538 IP 17.188.136.25.443 > 10.0.0.4.48754: Flags [P.], seq 375:438, ack 1008, win 308, options [nop,nop,TS val 13930070 ecr 266063864], length 63
12:41:40.460562 IP 10.0.0.4.48754 > 17.188.136.25.443: Flags [.], ack 438, win 288, options [nop,nop,TS val 266064009 ecr 13930070], length 0
12:41:51.802348 IP 10.0.0.4.48754 > 17.188.136.25.443: Flags [P.], seq 1008:1046, ack 438, win 288, options [nop,nop,TS val 266075350 ecr 13930070], length 38
12:41:51.802511 IP 10.0.0.4.48754 > 17.188.136.25.443: Flags [P.], seq 1046:1152, ack 438, win 288, options [nop,nop,TS val 266075351 ecr 13930070], length 106
12:41:51.946795 IP 17.188.136.25.443 > 10.0.0.4.48754: Flags [.], ack 1152, win 308, options [nop,nop,TS val 13941556 ecr 266075350], length 0
12:41:51.947242 IP 17.188.136.25.443 > 10.0.0.4.48754: Flags [P.], seq 438:499, ack 1152, win 308, options [nop,nop,TS val 13941556 ecr 266075350], length 61
12:41:51.947266 IP 10.0.0.4.48754 > 17.188.136.25.443: Flags [.], ack 499, win 288, options [nop,nop,TS val 266075495 ecr 13941556], length 0`


so far so good but suddenly the connection is broken with Apple and when the test (push) command then the tcpdump output is this and Google Chrome give me this error: ERR_SPDY_PROTOCOL_ERROR

`12:47:08.975013 IP 10.0.0.4.48754 > 17.188.136.25.443: Flags [P.], seq 1152:1190, ack 499, win 288, options [nop,nop,TS val 266392523 ecr 13941556], length 38
12:47:08.975128 IP 10.0.0.4.48754 > 17.188.136.25.443: Flags [P.], seq 1190:1296, ack 499, win 288, options [nop,nop,TS val 266392523 ecr 13941556], length 106
12:47:09.284537 IP 10.0.0.4.48754 > 17.188.136.25.443: Flags [P.], seq 1190:1296, ack 499, win 288, options [nop,nop,TS val 266392833 ecr 13941556], length 106
12:47:09.636540 IP 10.0.0.4.48754 > 17.188.136.25.443: Flags [P.], seq 1152:1296, ack 499, win 288, options [nop,nop,TS val 266393185 ecr 13941556], length 144
12:47:10.340547 IP 10.0.0.4.48754 > 17.188.136.25.443: Flags [P.], seq 1152:1296, ack 499, win 288, options [nop,nop,TS val 266393889 ecr 13941556], length 144
12:47:11.748540 IP 10.0.0.4.48754 > 17.188.136.25.443: Flags [P.], seq 1152:1296, ack 499, win 288, options [nop,nop,TS val 266395297 ecr 13941556], length 144
12:47:14.756536 IP 10.0.0.4.48754 > 17.188.136.25.443: Flags [P.], seq 1152:1296, ack 499, win 288, options [nop,nop,TS val 266398305 ecr 13941556], length 144
12:47:20.388547 IP 10.0.0.4.48754 > 17.188.136.25.443: Flags [P.], seq 1152:1296, ack 499, win 288, options [nop,nop,TS val 266403937 ecr 13941556], length 144
12:47:31.652545 IP 10.0.0.4.48754 > 17.188.136.25.443: Flags [P.], seq 1152:1296, ack 499, win 288, options [nop,nop,TS val 266415201 ecr 13941556], length 144
12:47:54.180592 IP 10.0.0.4.48754 > 17.188.136.25.443: Flags [P.], seq 1152:1296, ack 499, win 288, options [nop,nop,TS val 266437729 ecr 13941556], length 144
12:48:39.236608 IP 10.0.0.4.48754 > 17.188.136.25.443: Flags [P.], seq 1152:1296, ack 499, win 288, options [nop,nop,TS val 266482785 ecr 13941556], length 144
12:50:09.348562 IP 10.0.0.4.48754 > 17.188.136.25.443: Flags [P.], seq 1152:1296, ack 499, win 288, options [nop,nop,TS val 266572897 ecr 13941556], length 144
12:52:10.180581 IP 10.0.0.4.48754 > 17.188.136.25.443: Flags [P.], seq 1152:1296, ack 499, win 288, options [nop,nop,TS val 266693729 ecr 13941556], length 144
12:54:11.012595 IP 10.0.0.4.48754 > 17.188.136.25.443: Flags [P.], seq 1152:1296, ack 499, win 288, options [nop,nop,TS val 266814561 ecr 13941556], length 144
12:56:11.844537 IP 10.0.0.4.48754 > 17.188.136.25.443: Flags [P.], seq 1152:1296, ack 499, win 288, options [nop,nop,TS val 266935393 ecr 13941556], length 144
12:58:12.676571 IP 10.0.0.4.48754 > 17.188.136.25.443: Flags [P.], seq 1152:1296, ack 499, win 288, options [nop,nop,TS val 267056225 ecr 13941556], length 144
13:00:13.508575 IP 10.0.0.4.48754 > 17.188.136.25.443: Flags [P.], seq 1152:1296, ack 499, win 288, options [nop,nop,TS val 267177057 ecr 13941556], length 144
`

**Comment by arcidodo** [comment]
i used the release version: micromdm version 1.4.0-1-g32e0711. now i builded the latest version (mdmctl version v1.4.0-28-gf909214-dirty) and it just works now.
